[
  {
    "id": "AB-MASTER-01",
    "domain": "DOM-AB",
    "name": "Lanzamiento de programa",
    "objective": "Presentar un programa nuevo con contexto, beneficio, dato clave y cierre.",
    "formats": ["carousel", "reel", "story", "presentation"],
    "templateIds": ["CAR-015", "CAR-017", "REEL-020", "STO-001", "PRE-001"],
    "requiredCapabilities": ["launch-frame"],
    "recommendedCapabilities": ["brand-logo-slot", "water-symbol", "cta-strip"],
    "materials": ["logo", "dato clave", "beneficio", "foto opcional"],
    "status": "premium"
  },
  {
    "id": "AB-MASTER-02",
    "domain": "DOM-AB",
    "name": "Rutas semanales",
    "objective": "Explicar rutas, días, destinos, precio y contacto con continuidad territorial.",
    "formats": ["reel", "carousel", "story", "route"],
    "templateIds": ["REEL-018", "REEL-012", "CAR-006", "STO-011", "RTE-007"],
    "requiredCapabilities": ["route-path", "location-node"],
    "recommendedCapabilities": ["official-vehicle-slot", "house-cluster", "map-grid", "institutional-footer"],
    "materials": ["calendario validado", "destinos", "precio", "contacto", "vehículo oficial opcional"],
    "status": "premium"
  },
  {
    "id": "AB-MASTER-03",
    "domain": "DOM-AB",
    "name": "Testimonios",
    "objective": "Combinar testimonio real, contexto territorial y beneficio concreto sin sobreactuar.",
    "formats": ["reel", "carousel", "story"],
    "templateIds": ["REEL-008", "REEL-014", "CAR-019", "CAR-007", "STO-004"],
    "requiredCapabilities": ["real-photo-slot"],
    "recommendedCapabilities": ["quote-frame", "lower-third", "brand-logo-slot"],
    "materials": ["video o foto real", "cita autorizada", "colonia", "beneficio"],
    "status": "approved"
  },
  {
    "id": "AB-MASTER-04",
    "domain": "DOM-AB",
    "name": "Cómo funciona",
    "objective": "Explicar proceso, precio, cobertura y funcionamiento en pasos conectados.",
    "formats": ["carousel", "reel", "story", "data"],
    "templateIds": ["REEL-015", "CAR-005", "CAR-018", "DAT-004", "STO-007"],
    "requiredCapabilities": ["process-line"],
    "recommendedCapabilities": ["water-symbol", "data-ring", "cta-strip"],
    "materials": ["pasos", "precio", "cobertura", "contacto"],
    "status": "premium"
  },
  {
    "id": "OBRA-MASTER-01",
    "domain": "DOM-OBRA",
    "name": "Rehabilitación de pozo",
    "objective": "Mostrar problema previo, intervención técnica, recuperación de capacidad e impacto.",
    "formats": ["carousel", "reel", "data", "presentation"],
    "templateIds": ["CAR-002", "CAR-018", "REEL-014", "DAT-009", "PRE-004"],
    "requiredCapabilities": ["real-photo-slot"],
    "recommendedCapabilities": ["pipeline-section", "metric-bars", "lower-third"],
    "materials": ["fotos reales", "capacidad antes/ahora", "intervención", "impacto"],
    "status": "premium"
  },
  {
    "id": "OBRA-MASTER-02",
    "domain": "DOM-OBRA",
    "name": "Sustitución de tubería",
    "objective": "Explicar tramo intervenido, material anterior/nuevo, causa y beneficio operativo.",
    "formats": ["carousel", "reel", "data"],
    "templateIds": ["CAR-004", "CAR-018", "REEL-016", "DAT-002", "DAT-006"],
    "requiredCapabilities": ["pipeline-section"],
    "recommendedCapabilities": ["comparison-arrow", "real-photo-slot", "metric-bars"],
    "materials": ["longitud", "material", "fotos", "impacto"],
    "status": "premium"
  },
  {
    "id": "OBRA-MASTER-03",
    "domain": "DOM-OBRA",
    "name": "Gran infraestructura",
    "objective": "Narrar una obra mayor con inversión, beneficiarios, etapas, territorio y continuidad.",
    "formats": ["reel", "carousel", "presentation", "data"],
    "templateIds": ["REEL-020", "CAR-016", "CAR-022", "PRE-007", "DAT-010"],
    "requiredCapabilities": ["timeline-node"],
    "recommendedCapabilities": ["map-grid", "metric-bars", "real-photo-slot"],
    "materials": ["inversión", "beneficiarios", "etapas", "mapa", "fotos"],
    "status": "premium"
  },
  {
    "id": "OBRA-MASTER-04",
    "domain": "DOM-OBRA",
    "name": "Antes / después",
    "objective": "Contrastar situación inicial y resultado con evidencia y delta verificable.",
    "formats": ["carousel", "reel", "story", "data"],
    "templateIds": ["CAR-004", "REEL-016", "STO-006", "DAT-002"],
    "requiredCapabilities": ["comparison-arrow"],
    "recommendedCapabilities": ["real-photo-slot", "photo-mask"],
    "materials": ["antes", "después", "dato de cambio"],
    "status": "approved"
  },
  {
    "id": "BRIG-MASTER-01",
    "domain": "DOM-BRIG",
    "name": "Reparación operativa",
    "objective": "Comunicar problema, intervención en curso y efecto esperado de forma ágil.",
    "formats": ["carousel", "story", "reel"],
    "templateIds": ["CAR-018", "CAR-002", "STO-008", "REEL-004"],
    "requiredCapabilities": ["real-photo-slot"],
    "recommendedCapabilities": ["lower-third", "cta-strip"],
    "materials": ["fotos", "tipo de trabajo", "zona general", "estado"],
    "status": "approved"
  },
  {
    "id": "BRIG-MASTER-02",
    "domain": "DOM-BRIG",
    "name": "Drenaje y colectores",
    "objective": "Explicar obstrucción, reparación, limpieza o sustitución con lectura técnica accesible.",
    "formats": ["carousel", "reel", "data"],
    "templateIds": ["CAR-005", "CAR-018", "REEL-015", "DAT-006"],
    "requiredCapabilities": ["pipeline-section"],
    "recommendedCapabilities": ["process-line", "real-photo-slot"],
    "materials": ["problema", "intervención", "tramo general", "resultado"],
    "status": "approved"
  },
  {
    "id": "BRIG-MASTER-03",
    "domain": "DOM-BRIG",
    "name": "Atención extraordinaria",
    "objective": "Cubrir jornadas intensivas, guardias o trabajos continuos con secuencia territorial.",
    "formats": ["reel", "carousel", "story"],
    "templateIds": ["REEL-014", "REEL-019", "CAR-014", "STO-004"],
    "requiredCapabilities": ["real-photo-slot"],
    "recommendedCapabilities": ["timeline-node", "map-grid"],
    "materials": ["fotos", "frentes de trabajo", "periodo", "impacto"],
    "status": "approved"
  },
  {
    "id": "CULT-MASTER-01",
    "domain": "DOM-CULT",
    "name": "Taller / escuela",
    "objective": "Comunicar actividad educativa con aprendizaje, participación y evidencia visual.",
    "formats": ["carousel", "story", "reel"],
    "templateIds": ["CAR-005", "CAR-017", "REEL-003", "STO-007"],
    "requiredCapabilities": ["real-photo-slot"],
    "recommendedCapabilities": ["water-symbol", "quote-frame"],
    "materials": ["fotos", "tema", "participantes", "aprendizaje"],
    "status": "approved"
  },
  {
    "id": "CULT-MASTER-02",
    "domain": "DOM-CULT",
    "name": "Campaña de cuidado",
    "objective": "Convertir consejos o hábitos en una pieza didáctica clara y memorable.",
    "formats": ["carousel", "story", "reel"],
    "templateIds": ["CAR-009", "CAR-020", "REEL-017", "STO-002"],
    "requiredCapabilities": ["water-symbol"],
    "recommendedCapabilities": ["process-line", "cta-strip"],
    "materials": ["mensaje central", "consejos", "llamado"],
    "status": "approved"
  },
  {
    "id": "TEST-MASTER-01",
    "domain": "DOM-TEST",
    "name": "Testimonio corto",
    "objective": "Dar protagonismo a una voz real con cita, contexto y evidencia documental.",
    "formats": ["carousel", "reel", "story", "presentation"],
    "templateIds": ["CAR-019", "REEL-008", "STO-004", "PRE-004"],
    "requiredCapabilities": ["real-photo-slot"],
    "recommendedCapabilities": ["quote-frame", "lower-third"],
    "materials": ["foto/video", "cita", "nombre autorizado", "contexto"],
    "status": "approved"
  },
  {
    "id": "AMBI-MASTER-01",
    "domain": "DOM-AMBI",
    "name": "Acción ambiental",
    "objective": "Narrar reforestación, limpieza o cuidado de ecosistemas con evidencia y propósito.",
    "formats": ["carousel", "reel", "story"],
    "templateIds": ["CAR-014", "CAR-017", "REEL-014", "STO-004"],
    "requiredCapabilities": ["real-photo-slot"],
    "recommendedCapabilities": ["map-grid", "water-symbol"],
    "materials": ["fotos", "actividad", "impacto", "participación"],
    "status": "approved"
  },
  {
    "id": "AVIS-MASTER-01",
    "domain": "DOM-AVIS",
    "name": "Aviso de servicio",
    "objective": "Informar una afectación o actualización operativa con prioridad y claridad.",
    "formats": ["story", "carousel", "route"],
    "templateIds": ["STO-008", "STO-012", "RTE-004", "CAR-009"],
    "requiredCapabilities": ["notice-frame"],
    "recommendedCapabilities": ["cta-strip", "map-grid"],
    "materials": ["qué ocurre", "zona general", "recomendación", "contacto"],
    "status": "approved"
  },
  {
    "id": "AVIS-MASTER-02",
    "domain": "DOM-AVIS",
    "name": "Contingencia / emergencia",
    "objective": "Comunicar situación extraordinaria, prioridades y recuperación gradual sin saturación.",
    "formats": ["story", "carousel", "reel", "route"],
    "templateIds": ["STO-008", "REEL-019", "CAR-018", "RTE-006"],
    "requiredCapabilities": ["notice-frame"],
    "recommendedCapabilities": ["priority-marker", "map-grid", "cta-strip"],
    "materials": ["situación", "prioridades", "acciones", "contacto"],
    "status": "premium"
  },
  {
    "id": "RES-MASTER-01",
    "domain": "DOM-RES",
    "name": "Informe de resultados",
    "objective": "Sintetizar métricas, hallazgos, evidencia y cierre ejecutivo.",
    "formats": ["carousel", "reel", "data", "presentation"],
    "templateIds": ["CAR-022", "REEL-019", "DAT-009", "DAT-010", "PRE-008"],
    "requiredCapabilities": ["metric-bars"],
    "recommendedCapabilities": ["data-ring", "real-photo-slot"],
    "materials": ["cifras verificadas", "periodo", "hallazgo", "fuente"],
    "status": "premium"
  },
  {
    "id": "RES-MASTER-02",
    "domain": "DOM-RES",
    "name": "Contraste histórico",
    "objective": "Mostrar evolución antes/ahora con series o comparativos verificables.",
    "formats": ["carousel", "reel", "data", "presentation"],